"GMHDWJ5Y","journalArticle","2002","Avakian, Arpenik; Kalina, Robert E.; Sage, E. Helene; Rambhia, Avni H.; Elliott, Katherine E.; Chuang, Elaine L.; Clark, John I.; Hwang, Jenq-Neng; Parsons-Wingerter, Patricia","Fractal analysis of region-based vascular change in the normal and non-proliferative diabetic retina","Current Eye Research","","0271-3683","10.1076/ceyr.24.4.274.8411","","PURPOSE: Evaluation of normal and abnormal vascular pattern in the human retina using a novel method: quantitative region-based fractal analysis. METHODS: Binary (black/white) vascular patterns of the human retina originating at the optic disc were obtained by semi-automatic computer processing of digital images from 60-degree fundus fluorescein angiography of 5 normal eyes and 5 eyes with non-proliferative diabetic retinopathy (NPDR). As determined by image resolution, vascular patterns included vessels with diameters >or=50 microm and excluded small vessels and capillaries. The density of linearized (i.e., skeletonized) vascular patterns in the macular region versus paramacular region (termed ""region-based"" linearized vascular pattern) was quantified with the fractal dimension (D(f)) and confirmed by grid intersection (rho(v)). RESULTS: By region-based quantification, D(f) and rho( v) were significantly higher in the normal macular region than in the NPDR macular region (p = 0.008 and p = 0.019, respectively). However, differences in D(f) and rho(v) between the normal and NPDR paramacular regions were not strongly significant (p = 0.168 and p = 0.337, respectively). CONCLUSIONS: Results from the retrospective analytical study demonstrate the feasibility of using quantitative region-based fractal analysis of early-stage vascular disease in the human retina. The results are encouraging for a broader study of diverse patient populations.","2002-04","2025-07-24 20:26:39","2025-07-24 20:26:39","","274–280","","4","24","","","","","","","","","","english","","","","","","","Citation Key: avakianFractalAnalysisRegionbased2002 PMID: 12324866","","","","Humans; Fractals; Diabetic Retinopathy; Feasibility Studies; Fluorescein Angiography; Reference Values; Retinal Vessels; Retrospective Studies","","","","","","","","","","","","","","","","","","","","","","","","","","","","","","","","","","","","","","","","","","","","","","",""
"U5KBFGYL","journalArticle","2023","Nicolas, Nabil; Dinet, Virginie; Roux, Etienne","3D imaging and morphometric descriptors of vascular networks on optically cleared organs","iScience","","2589-0042","10.1016/j.isci.2023.108007","","The vascular system is a multi-scale network whose functionality depends on its structure, and for which structural alterations can be linked to pathological shifts. Though biologists use multiple 3D imaging techniques to visualize vascular networks, the 3D image processing methodologies remain sources of biases, and the extraction of quantitative morphometric descriptors remains flawed. The article, first, reviews the current 3D image processing methodologies, and morphometric descriptors of vascular network images mainly obtained by light-sheet microscopy on optically cleared organs, found in the literature. Second, it proposes operator-independent segmentation and skeletonization methodologies using the freeware ImageJ. Third, it gives more extractable network-level (density, connectivity, fractal dimension) and segment-level (length, diameter, tortuosity) 3D morphometric descriptors and how to statistically analyze them. Thus, it can serve as a guideline for biologists using 3D imaging techniques of vascular networks, allowing the production of more comparable studies in the future., Imaging anatomy; Optical imaging","2023-09","2025-07-24 20:26:39","2025-07-24 20:26:39","2025-07-17","108007","","10","26","","","","","","","","","","","","","","","","","Citation Key: nicolas3DImagingMorphometric2023 PMID: 37810224 tex.pmcid: PMC10551892","","","","","","","","","","","","","","","","","","","","","","","","","","","","","","","","","","","","","","","","","","","","","","","","","","",""
"8RWAIT9L","journalArticle","1956","Kruskal, Joseph B.","On the shortest spanning subtree of a graph and the traveling salesman problem","Proceedings of the American Mathematical Society","","0002-9939, 1088-6826","10.1090/S0002-9939-1956-0078686-7","","","1956","2025-07-24 20:26:39","2025-07-24 20:26:39","2025-07-17","48–50","","1","7","","","","","","","","","","english","","","","","","","Citation Key: kruskalShortestSpanningSubtree1956","","","","","","","","","","","","","","","","","","","","","","","","","","","","","","","","","","","","","","","","","","","","","","","","","","",""
"LLNTW36Q","journalArticle","1972","Edmonds, Jack; Karp, Richard M.","Theoretical Improvements in Algorithmic Efficiency for Network Flow Problems","Journal of The Acm","","0004-5411","10.1145/321694.321699","","","1972-04","2025-07-24 20:26:39","2025-07-24 20:26:39","2025-07-17","248–264","","2","19","","J. ACM","","","","","","","","","","","","","","","Citation Key: edmondsTheoreticalImprovementsAlgorithmic1972","","","","","","","","","","","","","","","","","","","","","","","","","","","","","","","","","","","","","","","","","","","","","","","","","","",""
"M8GVWFIP","journalArticle","2022","Stolz, Bernadette J.; Kaeppler, Jakob; Markelc, Bostjan; Braun, Franziska; Lipsmeier, Florian; Muschel, Ruth J.; Byrne, Helen M.; Harrington, Heather A.","Multiscale topology characterizes dynamic tumor vascular networks","Science Advances","","2375-2548","10.1126/sciadv.abm2456","","Advances in imaging techniques enable high-resolution three-dimensional (3D) visualization of vascular networks over time and reveal abnormal structural features such as twists and loops, and their quantification is an active area of research. Here, we showcase how topological data analysis, the mathematical field that studies the “shape” of data, can characterize the geometric, spatial, and temporal organization of vascular networks. We propose two topological lenses to study vasculature, which capture inherent multiscale features and vessel connectivity, and surpass the single-scale analysis of existing methods. We analyze images collected using intravital and ultramicroscopy modalities and quantify spatiotemporal variation of twists, loops, and avascular regions (voids) in 3D vascular networks. This topological approach validates and quantifies known qualitative trends such as dynamic changes in tortuosity and loops in response to antibodies that modulate vessel sprouting; furthermore, it quantifies the effect of radiotherapy on vessel architecture. , Topological data analysis enables deep quantification of response to drug and radiation treatment in 3D tumor vasculature.","2022-06","2025-07-24 20:26:39","2025-07-24 20:26:39","2025-04-26","eabm2456","","23","8","","","","","","","","","","english","","","","","","","Citation Key: stolzMultiscaleTopologyCharacterizes2022","","","","","","","","","","","","","","","","","","","","","","","","","","","","","","","","","","","","","","","","","","","","","","","","","","",""
"QK7GMWXJ","journalArticle","2019","Okamoto, Takayuki; Usuda, Haruki; Tanaka, Tetsuya; Wada, Koichiro; Shimaoka, Motomu","The Functional Implications of Endothelial Gap Junctions and Cellular Mechanics in Vascular Angiogenesis","Cancers","","2072-6694","10.3390/cancers11020237","","Angiogenesis—the sprouting and growth of new blood vessels from the existing vasculature—is an important contributor to tumor development, since it facilitates the supply of oxygen and nutrients to cancer cells. Endothelial cells are critically affected during the angiogenic process as their proliferation, motility, and morphology are modulated by pro-angiogenic and environmental factors associated with tumor tissues and cancer cells. Recent in vivo and in vitro studies have revealed that the gap junctions of endothelial cells also participate in the promotion of angiogenesis. Pro-angiogenic factors modulate gap junction function and connexin expression in endothelial cells, whereas endothelial connexins are involved in angiogenic tube formation and in the cell migration of endothelial cells. Several mechanisms, including gap junction function-dependent or -independent pathways, have been proposed. In particular, connexins might have the potential to regulate cell mechanics such as cell morphology, cell migration, and cellular stiffness that are dynamically changed during the angiogenic processes. Here, we review the implication for endothelial gap junctions and cellular mechanics in vascular angiogenesis.","2019-02","2025-07-24 20:26:39","2025-07-24 20:26:39","2025-04-26","237","","2","11","","","","","","","","","","","","","","","","","Citation Key: okamotoFunctionalImplicationsEndothelial2019 PMID: 30781714 tex.pmcid: PMC6406946","","","","","","","","","","","","","","","","","","","","","","","","","","","","","","","","","","","","","","","","","","","","","","","","","","",""
"3F8EGPX4","journalArticle","2020","Ricardo Santamarı́a; Santamaría, Ricardo; M. González-Álvarez; González-Álvarez, María; R. García Delgado; Delgado, Raquel; Sergio Esteban; Esteban, Sergio; Alicia G. Arroyo; Arroyo, Alicia G.","Remodeling of the Microvasculature: May the Blood Flow Be With You.","Frontiers in Physiology","","","10.3389/fphys.2020.586852","","The vasculature ensures optimal delivery of nutrients and oxygen throughout the body, and to achieve this function it must continually adapt to varying tissue demands. Newly formed vascular plexus during development are immature and required dynamic remodeling to generate well-patterned functional networks. This is achieved by remodeling of the capillaries preserving those which are functional and eliminating other ones. A balanced and dynamically regulated capillary remodeling will therefore ensure optimal distribution of blood and nutrients to the tissues. This is particularly important in pathological context in which deficient or excessive vascular remodeling may worsen tissue perfusion and hamper tissue repair. Blood flow is a major determinant of microvascular reshaping since capillaries are pruned when relatively less perfused and they split when exposed to high flow in order to shape the microvascular network for optimal tissue perfusion and oxygenation. The molecular machinery underlying blood flow sensing by endothelial cells is being deciphered, but much less is known about how this translates into endothelial cell responses as alignment, polarization and directed migration to drive capillary remodeling, particularly in vivo. Part of this knowledge is theoretical from computational models since blood flow hemodynamics are not easily recapitulated by in vitro or ex vivo approaches. Moreover, these events are difficult to visualize in vivo due their infrequency and briefness. Studies had been limited to postnatal mouse retina and vascular beds in zebrafish but new tools as advanced microscopy and image analysis are strengthening our understanding of capillary remodeling. In this review we introduce the concept of remodeling of the microvasculature and its relevance in physiology and pathology. We summarize the current knowledge on the mechanisms contributing to capillary regression and to capillary splitting highlighting the key role of blood flow to orchestrate this process. Finally, we comment the potential and possibilities that microfluidics offers to this field. Since capillary remodeling mechanisms are often reactivated in prevalent pathologies as cancer and cardiovascular disease, all this knowledge could be eventually used to improve the functionality of capillary networks in diseased tissues and promote their repair.","2020","2025-07-24 20:26:39","2025-07-24 20:26:39","","586852","","","11","","","","","","","","","","","","","","","","","Citation Key: ricardosantamariaRemodelingMicrovasculatureMay2020","","","","","","","","","","","","","","","","","","","","","","","","","","","","","","","","","","","","","","","","","","","","","","","","","","",""
"Z7EN3UUS","journalArticle","2017","Henrik Ronellenfitsch; Ronellenfitsch, Henrik; Eleni Katifori; Katifori, Eleni","The Phenotypes of Fluctuating Flow: Development of Distribution Networks in Biology and the Trade-off between Efficiency, Cost, and Resilience","arXiv: Adaptation and Self-Organizing Systems","","","","","Complex distribution networks are pervasive in biology. Examples include nutrient transport in the slime mold $Physarum$ $polycephalum$ as well as mammalian and plant venation. Adaptive rules are believed to guide development of these networks and lead to a reticulate, hierarchically nested topology that is both efficient and resilient against perturbations. However, as of yet no mechanism is known that can generate such networks on all scales. We show how hierarchically organized reticulation can be generated and maintained through spatially collective load fluctuations on a particular length scale. We demonstrate that the resulting network topologies represent a trade-off between optimizing power dissipation, construction cost, and damage robustness and identify the Pareto-efficient front that evolution is expected to favor and select for. We show that the typical fluctuation length scale controls the position of the networks on the Pareto front and thus on the spectrum of venation phenotypes. We compare the Pareto archetypes predicted by our model with examples of real leaf networks.","2017-07","2025-07-24 20:26:39","2025-07-24 20:26:39","","","","","","","","","","","","","","","","","","","","","","Citation Key: henrikronellenfitschPhenotypesFluctuatingFlow2017","","","","","","","","","","","","","","","","","","","","","","","","","","","","","","","","","","","","","","","","","","","","","","","","","","",""
"MGTV7EHM","journalArticle","2010","Francis Corson; Corson, Francis","Fluctuations and redundancy in optimal transport networks.","Physical Review Letters","","","10.1103/physrevlett.104.048703","","The structure of networks that provide optimal transport properties has been investigated in a variety of contexts. While many different formulations of this problem have been considered, it is recurrently found that optimal networks are trees. It is shown here that this result is contingent on the assumption of a stationary flow through the network. When time variations or fluctuations are allowed for, a different class of optimal structures is found, which share the hierarchical organization of trees yet contain loops. The transitions between different network topologies as the parameters of the problem vary are examined. These results may have strong implications for the structure and formation of natural networks, as is illustrated by the example of leaf venation networks.","2010-01","2025-07-24 20:26:39","2025-07-24 20:26:39","","048703–048703","","4","104","","","","","","","","","","","","","","","","","Citation Key: franciscorsonFluctuationsRedundancyOptimal2010 PMID: 20366745","","","","","","","","","","","","","","","","","","","","","","","","","","","","","","","","","","","","","","","","","","","","","","","","","","",""
"C8Y2GRI6","journalArticle","2000","Jayanth R. Banavar; Banavar, Jayanth R.; Francesca Colaiori; Colaiori, Francesca; Alessandro Flammini; Flammini, Alessandro; Amos Maritan; Maritan, Amos; Andrea Rinaldo; Rinaldo, Andrea","Topology of the fittest transportation network.","Physical Review Letters","","","10.1103/physrevlett.84.4745","","The presence or absence of loops in the emergent transportation networks, that are characterized by a minimum overall cost, is shown to depend on the convexity of the cost function for the local transportation of material. Our results are directly applicable to a variety of situations across disciplines.","2000-05","2025-07-24 20:26:39","2025-07-24 20:26:39","","4745–4748","","20","84","","","","","","","","","","","","","","","","","Citation Key: jayanthr.banavarTopologyFittestTransportation2000 PMID: 10990786","","","","","","","","","","","","","","","","","","","","","","","","","","","","","","","","","","","","","","","","","","","","","","","","","","",""
"UAGIY4AU","journalArticle","2016","Ronellenfitsch, Henrik; Katifori, Eleni","Global Optimization, Local Adaptation, and the Role of Growth in Distribution Networks","Physical Review Letters","","","10.1103/PhysRevLett.117.138301","","Highly optimized complex transport networks serve crucial functions in many man-made and natural systems such as power grids and plant or animal vasculature. Often, the relevant optimization functional is nonconvex and characterized by many local extrema. In general, finding the global, or nearly global optimum is difficult. In biological systems, it is believed that such an optimal state is slowly achieved through natural selection. However, general coarse grained models for flow networks with local positive feedback rules for the vessel conductivity typically get trapped in low efficiency, local minima. In this work we show how the growth of the underlying tissue, coupled to the dynamical equations for network development, can drive the system to a dramatically improved optimal state. This general model provides a surprisingly simple explanation for the appearance of highly optimized transport networks in biology such as leaf and animal vasculature.","2016-09","2025-07-24 20:26:39","2025-07-24 20:26:39","2024-09-19","138301","","13","117","","","","","","","","","","","","","","","","","Citation Key: Ronellenfitsch2016 Publisher: American Physical Society","","","","","","","","","","","","","","","","","","","","","","","","","","","","","","","","","","","","","","","","","","","","","","","","","","",""
"AV67GJS5","journalArticle","2023","Crawshaw, Jessica R.; Flegg, Jennifer A.; Bernabeu, Miguel O.; Osborne, James M.","Mathematical models of developmental vascular remodelling: A review","PLOS Computational Biology","","1553-7358","10.1371/journal.pcbi.1011130","","Over the past 40 years, there has been a strong focus on the development of mathematical models of angiogenesis, while developmental remodelling has received little such attention from the mathematical community. Sprouting angiogenesis can be seen as a very crude way of laying out a primitive vessel network (the raw material), while remodelling (understood as pruning of redundant vessels, diameter control, and the establishment of vessel identity and hierarchy) is the key to turning that primitive network into a functional network. This multiscale problem is of prime importance in the development of a functional vasculature. In addition, defective remodelling (either during developmental remodelling or due to a reactivation of the remodelling programme caused by an injury) is associated with a significant number of diseases. In this review, we discuss existing mathematical models of developmental remodelling and explore the important contributions that these models have made to the field of vascular development. These mathematical models are effectively used to investigate and predict vascular development and are able to reproduce experimentally observable results. Moreover, these models provide a useful means of hypothesis generation and can explain the underlying mechanisms driving the observed structural and functional network development. However, developmental vascular remodelling is still a relatively new area in mathematical biology, and many biological questions remain unanswered. In this review, we present the existing modelling paradigms and define the key challenges for the field.","2023-08","2025-07-24 20:26:39","2025-07-24 20:26:39","2025-07-16","e1011130","","8","19","","","Mathematical models of developmental vascular remodelling","","","","","","","english","","","","","","","Citation Key: crawshawMathematicalModelsDevelopmental2023k Publisher: Public Library of Science","","","","Capillaries; Blood flow; Endothelial cells; Mathematical models; Cell signaling; In vivo imaging; Shear stresses; Wnt signaling cascade","","","","","","","","","","","","","","","","","","","","","","","","","","","","","","","","","","","","","","","","","","","","","","",""
"8ISTHWUL","journalArticle","1926","Cecil D. Murray; Murray, Cecil D.","THE PHYSIOLOGICAL PRINCIPLE OF MINIMUM WORK APPLIED TO THE ANGLE OF BRANCHING OF ARTERIES","The Journal of General Physiology","","","10.1085/jgp.9.6.835","","","1926-07","2025-07-24 20:26:39","2025-07-24 20:26:39","","835–841","","6","9","","","","","","","","","","","","","","","","","Citation Key: cecild.murrayPHYSIOLOGICALPRINCIPLEMINIMUM1926a PMID: 19872299 tex.pmcid: 2140901","","","","","","","","","","","","","","","","","","","","","","","","","","","","","","","","","","","","","","","","","","","","","","","","","","",""
"NAZS8H3H","journalArticle","2010","Tero, Atsushi; Takagi, Seiji; Saigusa, Tetsu; Ito, Kentaro; Bebber, Dan P.; Fricker, Mark D.; Yumiki, Kenji; Kobayashi, Ryo; Nakagaki, Toshiyuki","Rules for biologically inspired adaptive network design","Science (New York, N.Y.)","","1095-9203","10.1126/science.1177894","","Transport networks are ubiquitous in both social and biological systems. Robust network performance involves a complex trade-off involving cost, transport efficiency, and fault tolerance. Biological networks have been honed by many cycles of evolutionary selection pressure and are likely to yield reasonable solutions to such combinatorial optimization problems. Furthermore, they develop without centralized control and may represent a readily scalable solution for growing networks in general. We show that the slime mold Physarum polycephalum forms networks with comparable efficiency, fault tolerance, and cost to those of real-world infrastructure networks–in this case, the Tokyo rail system. The core mechanisms needed for adaptive network formation can be captured in a biologically inspired mathematical model that may be useful to guide network construction in other domains.","2010-01","2025-07-24 20:26:39","2025-07-24 20:26:39","","439–442","","5964","327","","","","","","","","","","english","","","","","","","Citation Key: Tero2010 PMID: 20093467","","","","Biological; Computer Simulation; Models; Algorithms; Food; Physarum polycephalum; Railroads; Systems Biology; Tokyo","","","","","","","","","","","","","","","","","","","","","","","","","","","","","","","","","","","","","","","","","","","","","","",""
