"JUIXU4VM","journalArticle","2024","Stanton, Katherine; Philippou, Helen; Ariëns, Robert AS","Ischaemic Stroke, Thromboembolism and Clot Structure","Neuroscience","","0306-4522","10.1016/j.neuroscience.2024.02.024","","Ischaemic stroke is a major cause of morbidity and mortality worldwide. Blood clotting and thromboembolism play a central role in the pathogenesis of ischaemic stroke. An increasing number of recent studies indicate changes in blood clot structure and composition in patients with ischaemic stroke. In this review, we aim to summarise and discuss clot structure, function and composition in ischaemic stroke, including its relationships with clinical diagnosis and treatment options such as thrombolysis and thrombectomy. Studies are summarised in which clot structure and composition is analysed both in vitro from patients' plasma samples and ex vivo in thrombi obtained through interventional catheter-mediated thrombectomy. Mechanisms that drive clot composition and architecture such as neutrophil extracellular traps and clot contraction are also discussed. We find that, while in vitro clot structure in plasma samples from ischaemic stroke patients are consistently altered, showing denser clots that are more resistant to fibrinolysis, current data on the composition and architecture of ex vivo clots obtained by thrombectomy are more variable. With the potential of advances in technologies underpinning both the imaging and retrieving of clots, we expect that future studies in this area will generate new data that is of interest for the diagnosis, optimal treatment strategies and clinical management of patients with ischaemic stroke.","2024-07","2025-07-24 20:26:38","2025-07-24 20:26:38","2025-07-22","3–10","","","550","","","","ISCHEMIC STROKE: From fibrinolysis to functional recovery","","","","","","","","","","","","","Citation Key: stantonIschaemicStrokeThromboembolism2024","","","","clot structure; fibrinogen; fibrinolysis; stroke; thrombectomy; thromboembolism","","","","","","","","","","","","","","","","","","","","","","","","","","","","","","","","","","","","","","","","","","","","","","",""
"WY5TYPSM","journalArticle","2015","Muz, Barbara; de la Puente, Pilar; Azab, Feda; Azab, Abdel Kareem","The role of hypoxia in cancer progression, angiogenesis, metastasis, and resistance to therapy","Hypoxia","","2324-1128","10.2147/HP.S93413","","Hypoxia is a non-physiological level of oxygen tension, a phenomenon common in a majority of malignant tumors. Tumor-hypoxia leads to advanced but dysfunctional vascularization and acquisition of epithelial-to-mesenchymal transition phenotype resulting in cell mobility and metastasis. Hypoxia alters cancer cell metabolism and contributes to therapy resistance by inducing cell quiescence. Hypoxia stimulates a complex cell signaling network in cancer cells, including the HIF, PI3K, MAPK, and NFKB pathways, which interact with each other causing positive and negative feedback loops and enhancing or diminishing hypoxic effects. This review provides background knowledge on the role of tumor hypoxia and the role of the HIF cell signaling involved in tumor blood vessel formation, metastasis, and development of the resistance to therapy. Better understanding of the role of hypoxia in cancer progression will open new windows for the discovery of new therapeutics targeting hypoxic tumor cells and hypoxic microenvironment.","2015-12","2025-07-24 20:26:38","2025-07-24 20:26:38","2025-07-22","83–92","","","3","","","","","","","","","","","","","","","","","Citation Key: muzRoleHypoxiaCancer2015 PMID: 27774485 tex.pmcid: PMC5045092","","","","","","","","","","","","","","","","","","","","","","","","","","","","","","","","","","","","","","","","","","","","","","","","","","",""
"DG4IEIN5","conferencePaper","2008","Hagberg, Aric A.; Schult, Daniel A.; Swart, Pieter J.","Exploring network structure, dynamics, and function using NetworkX","Proceedings of the 7th python in science conference","","","","","","2008","2025-07-24 20:26:38","2025-07-24 20:26:38","","11 - 15","","","","","","","","","","","","Pasadena, CA USA","","","","","","","","Citation Key: SciPyProceedings_11","","","","","","Varoquaux, Gaël; Vaught, Travis; Millman, Jarrod","","","","","","","","","","","","","","","","","","","","","","","","","","","","","","","","","","","","","","","","","","","","",""
"A5FPPQY9","book","2001","Godsil, Chris; Royle, Gordon","Algebraic graph theory","","","","","","","2001-04","2025-07-24 20:26:38","2025-07-24 20:26:38","","","","","","","","","Graduate texts in mathematics","","","","Springer","New York, NY","en","","","","","","","Citation Key: Godsil2001-gy","","","","","","","","","","","","","","","","","","","","","","","","","2001","","","","","","","","","","","","","","","","","","","","","","","","","",""
"27ABJDCA","journalArticle","2019","Lim; Lim, Lek-Heng","Hodge Laplacians on graphs","","","","10.48550/arXiv.1507.05379","http://arxiv.org/abs/1507.05379","This is an elementary introduction to the Hodge Laplacian on a graph, a higher-order generalization of the graph Laplacian. We will discuss basic properties including cohomology and Hodge theory. The main feature of our approach is simplicity, requiring only knowledge of linear algebra and graph theory. We have also isolated the algebra from the topology to show that a large part of cohomology and Hodge theory is nothing more than the linear algebra of matrices satisfying $AB = 0$. For the remaining topological aspect, we cast our discussions entirely in terms of graphs as opposed to less-familiar topological objects like simplicial complexes.","2019-08","2025-07-24 20:26:38","2025-07-24 20:26:38","2024-12-29","","","","","","","","","","","","","","","","","","","","","Citation Key: Lim2019 Publisher: arXiv","","","","Computer Science - Information Theory; Mathematics - Information Theory","","","","","Lim, Lek-Heng","","","","","","","","","","","","","","","","","","","","","","","","","","","","","","","","","","","","","","","","","",""
"L2RI45TF","journalArticle","2017","Reglin, B.; Secomb, T. W.","Mechanisms of hypoxia-induced angiogenesis and its role in cancer therapy","Frontiers in Physiology","","","10.3389/fphys.2017.01151","","","2017","2025-07-24 20:26:38","2025-07-24 20:26:38","","1151","","","8","","","","","","","","","","","","","","","","","Citation Key: Reglin2017","","","","","","","","","","","","","","","","","","","","","","","","","","","","","","","","","","","","","","","","","","","","","","","","","","",""
"LTP8YUAA","journalArticle","2023","Sarkar, Supriyo; Sen, Anirban; Bhattacharya, S.","A systems biology approach to modeling inflammation-induced angiogenesis via IL-6 signaling","npj Systems Biology and Applications","","","10.1038/s41540-023-00264-w","","","2023","2025-07-24 20:26:38","2025-07-24 20:26:38","","4","","1","9","","","","","","","","","","","","","","","","","Citation Key: Sarkar2023","","","","","","","","","","","","","","","","","","","","","","","","","","","","","","","","","","","","","","","","","","","","","","","","","","",""
"2SY3VPFX","journalArticle","2024","Guerra, Roberta; Adib, Sepideh; Kuhl, Ellen","A meshless computational model for strain-induced angiogenesis in soft tissue","Biomedicines","","","10.3390/biomedicines12030385","","","2024","2025-07-24 20:26:38","2025-07-24 20:26:38","","385","","3","12","","","","","","","","","","","","","","","","","Citation Key: Guerra2024","","","","","","","","","","","","","","","","","","","","","","","","","","","","","","","","","","","","","","","","","","","","","","","","","","",""
"VHBCIFJP","journalArticle","2020","Phillips, C. M.; Lima, E. A. B. F.; Linninger, A. A.","A hybrid mathematical model for tumor-induced angiogenesis","PLOS ONE","","","10.1371/journal.pone.0231137","","","2020","2025-07-24 20:26:38","2025-07-24 20:26:38","","e0231137","","6","15","","","","","","","","","","","","","","","","","Citation Key: Phillips2020","","","","","","","","","","","","","","","","","","","","","","","","","","","","","","","","","","","","","","","","","","","","","","","","","","",""
"TQYQIIS3","journalArticle","2012","Hu, Dan; Cai, David; Levine, Herbert","Adaptation and optimization of vascular networks in fluctuating tissue environments","PLoS ONE","","","10.1371/journal.pone.0031711","","","2012","2025-07-24 20:26:38","2025-07-24 20:26:38","","e31711","","3","7","","","","","","","","","","","","","","","","","Citation Key: Hu2012","","","","","","","","","","","","","","","","","","","","","","","","","","","","","","","","","","","","","","","","","","","","","","","","","","",""
"7955I5DB","conferencePaper","2023","Simões, Rita; dos Santos, Pedro; Pinto, F.; Silva, Carlos A.","Learning to grow vascular networks: a reinforcement learning approach","Lecture notes in computer science (LNCS)","","","10.1007/978-3-031-43287-8_8","","","2023","2025-07-24 20:26:38","2025-07-24 20:26:38","","99–113","","","13941","","","","","","","","Springer","","","","","","","","","Citation Key: Simoes2023","","","","","","","","","","","","","","","","","","","","","","","","","","","","","","","","","","","","","","","","","","","","","","","","","","",""
"GTZWAD9X","journalArticle","2021","Ouarné, Marie; Pena, Andreia; Franco, Cláudio Areias","From remodeling to quiescence: The transformation of the vascular network","Cells & Development","","2667-2901","10.1016/j.cdev.2021.203735","","The vascular system is essential for embryogenesis, healing, and homeostasis. Dysfunction or deregulated blood vessel function contributes to multiple diseases, including diabetic retinopathy, cancer, hypertension, or vascular malformations. A balance between the formation of new blood vessels, vascular remodeling, and vessel quiescence is fundamental for tissue growth and function. Whilst the major mechanisms contributing to the formation of new blood vessels have been well explored in recent years, vascular remodeling and quiescence remain poorly understood. In this review, we highlight the cellular and molecular mechanisms responsible for vessel remodeling and quiescence during angiogenesis. We further underline how impaired remodeling and/or destabilization of vessel networks can contribute to vascular pathologies. Finally, we speculate how addressing the molecular mechanisms of vascular remodeling and stabilization could help to treat vascular-related disorders.","2021-12","2025-07-24 20:26:38","2025-07-24 20:26:38","","203735","","","168","","","From remodeling to quiescence","","","","","","","english","","","","","","","Citation Key: Ouarne2021 PMID: 34425253","","","","Endothelial cell; Humans; Neovascularization; Pathologic; Angiogenesis; Vascular disease; Vascular quiescence; Vascular remodeling; Vascular Remodeling","","","","","","","","","","","","","","","","","","","","","","","","","","","","","","","","","","","","","","","","","","","","","","",""
"86TQI8XK","journalArticle","2012","Secomb, Timothy W.; Dewhirst, Mark W.; Pries, Axel R.","Structural Adaptation of Normal and Tumour Vascular Networks","Basic & Clinical Pharmacology & Toxicology","","1742-7843","10.1111/j.1742-7843.2011.00815.x","","Abstract: Vascular networks are dynamic structures, adapting to changing conditions by structural remodelling of vessel diameters and by growth of new vessels and regression of existing vessels. The vast number of blood vessels in the circulatory system, more than 109, implies that vessels' arrangement and structure are not under individual genetic control but emerge as a result of generic responses of each segment to the various stimuli that it experiences. To obtain insight into the types of response that are needed, a network-oriented approach has been used, in which theoretical models are used to simulate structural adaptation in vascular networks, and the results are compared with experimental observations. With regard to the structural control of vessel diameters, this approach shows that responses to both haemodynamic and metabolic stimuli are needed for the formation of functionally adequate and efficient network structures. Furthermore, information transfer in both upstream and downstream directions is essential for balancing flows between long and short flow pathways. Otherwise, functional shunting occurs, that is, short pathways become enlarged and flow bypasses longer pathways. Information transfer in the upstream direction is achieved by conducted responses communicated along vessel walls. Simulations of structural adaptation in tumour microvascular networks indicate that impaired vascular communication, resulting in functional shunting, may be an important factor causing the dysfunctional microcirculation and local hypoxia typically observed in tumours. Anti-angiogenic treatment of tumours may restore vascular communication and thereby improve or normalize flow distribution in tumour vasculature.","2012","2025-07-24 20:26:38","2025-07-24 20:26:38","2024-09-19","63–69","","1","110","","","","","","","","","","english","","","","","","","Citation Key: Secomb2012 tex.copyright: © 2011 The Authors. Basic & Clinical Pharmacology & Toxicology © 2011 Nordic Pharmacological Society","","","","","","","","","","","","","","","","","","","","","","","","","","","","","","","","","","","","","","","","","","","","","","","","","","",""
"J2T9AFAI","journalArticle","2014","Pries, Axel R.; Secomb, Timothy W.","Making Microvascular Networks Work: Angiogenesis, Remodeling, and Pruning","Physiology","","1548-9213","10.1152/physiol.00012.2014","","The adequate and efficient functioning of the microcirculation requires not only numerous vessels providing a large surface area for transport but also a structure that provides short diffusion distances from capillaries to tissue and efficient distribution of convective blood flow. Theoretical models show how a combination of angiogenesis, remodeling, and pruning in response to hemodynamic and metabolic stimuli, termed “angioadaptation,” generates well organized, functional networks.","2014-11","2025-07-24 20:26:38","2025-07-24 20:26:38","2024-09-19","446–455","","6","29","","","Making Microvascular Networks Work","","","","","","","","","","","","","","Citation Key: Pries2014 PMID: 25362638 tex.pmcid: PMC4280154","","","","","","","","","","","","","","","","","","","","","","","","","","","","","","","","","","","","","","","","","","","","","","","","","","",""
"BFQ8RWUZ","journalArticle","2020","Ricardo Santamarı́a; Santamaría, Ricardo; M. González-Álvarez; González-Álvarez, María; R. García Delgado; Delgado, Raquel; Sergio Esteban; Esteban, Sergio; Alicia G. Arroyo; Arroyo, Alicia G.","Remodeling of the Microvasculature: May the Blood Flow Be With You.","Frontiers in Physiology","","","10.3389/fphys.2020.586852","","The vasculature ensures optimal delivery of nutrients and oxygen throughout the body, and to achieve this function it must continually adapt to varying tissue demands. Newly formed vascular plexus during development are immature and required dynamic remodeling to generate well-patterned functional networks. This is achieved by remodeling of the capillaries preserving those which are functional and eliminating other ones. A balanced and dynamically regulated capillary remodeling will therefore ensure optimal distribution of blood and nutrients to the tissues. This is particularly important in pathological context in which deficient or excessive vascular remodeling may worsen tissue perfusion and hamper tissue repair. Blood flow is a major determinant of microvascular reshaping since capillaries are pruned when relatively less perfused and they split when exposed to high flow in order to shape the microvascular network for optimal tissue perfusion and oxygenation. The molecular machinery underlying blood flow sensing by endothelial cells is being deciphered, but much less is known about how this translates into endothelial cell responses as alignment, polarization and directed migration to drive capillary remodeling, particularly in vivo. Part of this knowledge is theoretical from computational models since blood flow hemodynamics are not easily recapitulated by in vitro or ex vivo approaches. Moreover, these events are difficult to visualize in vivo due their infrequency and briefness. Studies had been limited to postnatal mouse retina and vascular beds in zebrafish but new tools as advanced microscopy and image analysis are strengthening our understanding of capillary remodeling. In this review we introduce the concept of remodeling of the microvasculature and its relevance in physiology and pathology. We summarize the current knowledge on the mechanisms contributing to capillary regression and to capillary splitting highlighting the key role of blood flow to orchestrate this process. Finally, we comment the potential and possibilities that microfluidics offers to this field. Since capillary remodeling mechanisms are often reactivated in prevalent pathologies as cancer and cardiovascular disease, all this knowledge could be eventually used to improve the functionality of capillary networks in diseased tissues and promote their repair.","2020","2025-07-24 20:26:38","2025-07-24 20:26:38","","586852","","","11","","","","","","","","","","","","","","","","","Citation Key: ricardosantamariaRemodelingMicrovasculatureMay2020","","","","","","","","","","","","","","","","","","","","","","","","","","","","","","","","","","","","","","","","","","","","","","","","","","",""
"YHJ4ZK73","journalArticle","2010","Tero, Atsushi; Takagi, Seiji; Saigusa, Tetsu; Ito, Kentaro; Bebber, Dan P.; Fricker, Mark D.; Yumiki, Kenji; Kobayashi, Ryo; Nakagaki, Toshiyuki","Rules for biologically inspired adaptive network design","Science (New York, N.Y.)","","1095-9203","10.1126/science.1177894","","Transport networks are ubiquitous in both social and biological systems. Robust network performance involves a complex trade-off involving cost, transport efficiency, and fault tolerance. Biological networks have been honed by many cycles of evolutionary selection pressure and are likely to yield reasonable solutions to such combinatorial optimization problems. Furthermore, they develop without centralized control and may represent a readily scalable solution for growing networks in general. We show that the slime mold Physarum polycephalum forms networks with comparable efficiency, fault tolerance, and cost to those of real-world infrastructure networks–in this case, the Tokyo rail system. The core mechanisms needed for adaptive network formation can be captured in a biologically inspired mathematical model that may be useful to guide network construction in other domains.","2010-01","2025-07-24 20:26:38","2025-07-24 20:26:38","","439–442","","5964","327","","","","","","","","","","english","","","","","","","Citation Key: Tero2010 PMID: 20093467","","","","Biological; Computer Simulation; Models; Algorithms; Food; Physarum polycephalum; Railroads; Systems Biology; Tokyo","","","","","","","","","","","","","","","","","","","","","","","","","","","","","","","","","","","","","","","","","","","","","","",""
"U4H73GJB","journalArticle","2010","Pries, Axel R.; Höpfner, Michael; le Noble, Ferdinand; Dewhirst, Mark W.; Secomb, Timothy W.","The shunt problem: Control of functional shunting in normal and tumour vasculature","Nature reviews. Cancer","","1474-175X","10.1038/nrc2895","https://www.ncbi.nlm.nih.gov/pmc/articles/PMC3109666/","Networks of blood vessels in normal and tumour tissues have heterogeneous structures, with widely varying blood flow pathway lengths. To achieve efficient blood flow distribution, mechanisms for the structural adaptation of vessel diameters must be able to inhibit the formation of functional shunts (whereby short pathways become enlarged and flow bypasses long pathways). Such adaptation requires information about tissue metabolic status to be communicated upstream to feeding vessels, through conducted responses. We propose that impaired vascular communication in tumour microvascular networks, leading to functional shunting, is a primary cause of dysfunctional microcirculation and local hypoxia in cancer. We suggest that anti-angiogenic treatment of tumours may restore vascular communication and thereby improve or normalize flow distribution in tumour vasculature.","2010-08","2025-07-24 20:26:38","2025-07-24 20:26:38","2025-04-26","587–593","","8","10","","Nat Rev Cancer","The shunt problem","","","","","","","","","","","","","","Citation Key: priesShuntProblemControl2010 PMID: 20631803 tex.pmcid: PMC3109666","","","","","","","","","","","","","","","","","","","","","","","","","","","","","","","","","","","","","","","","","","","","","","","","","","",""
"2ANMT5M8","journalArticle","2021","Uçar, Mehmet Can; Kamenev, Dmitrii; Sunadome, Kazunori; Fachet, Dominik; Lallemend, Francois; Adameyko, Igor; Hadjab, Saida; Hannezo, Edouard","Theory of branching morphogenesis by local interactions and global guidance","Nature Communications","","2041-1723","10.1038/s41467-021-27135-5","","Branching morphogenesis governs the formation of many organs such as lung, kidney, and the neurovascular system. Many studies have explored system-specific molecular and cellular regulatory mechanisms, as well as self-organizing rules underlying branching morphogenesis. However, in addition to local cues, branched tissue growth can also be influenced by global guidance. Here, we develop a theoretical framework for a stochastic self-organized branching process in the presence of external cues. Combining analytical theory with numerical simulations, we predict differential signatures of global vs. local regulatory mechanisms on the branching pattern, such as angle distributions, domain size, and space-filling efficiency. We find that branch alignment follows a generic scaling law determined by the strength of global guidance, while local interactions influence the tissue density but not its overall territory. Finally, using zebrafish innervation as a model system, we test these key features of the model experimentally. Our work thus provides quantitative predictions to disentangle the role of different types of cues in shaping branched structures across scales.","2021-11","2025-07-24 20:26:38","2025-07-24 20:26:38","","6830","","1","12","","","","","","","","","","english","","","","","","","Citation Key: Ucar2021 PMID: 34819507 tex.pmcid: PMC8613190","","","","Animals; Biological; Models; Stochastic Processes; Animal; Genes; Genetically Modified; Intravital Microscopy; Morphogenesis; Reporter; Sensory Receptor Cells; Zebrafish","","","","","","","","","","","","","","","","","","","","","","","","","","","","","","","","","","","","","","","","","","","","","","",""
"FGPNEHQG","journalArticle","2021","Nardini, John T.; Stolz, Bernadette J.; Flores, Kevin B.; Harrington, Heather A.; Byrne, Helen M.","Topological data analysis distinguishes parameter regimes in the Anderson-Chaplain model of angiogenesis","PLoS Computational Biology","","1553-734X","10.1371/journal.pcbi.1009094","","Angiogenesis is the process by which blood vessels form from pre-existing vessels. It plays a key role in many biological processes, including embryonic development and wound healing, and contributes to many diseases including cancer and rheumatoid arthritis. The structure of the resulting vessel networks determines their ability to deliver nutrients and remove waste products from biological tissues. Here we simulate the Anderson-Chaplain model of angiogenesis at different parameter values and quantify the vessel architectures of the resulting synthetic data. Specifically, we propose a topological data analysis (TDA) pipeline for systematic analysis of the model. TDA is a vibrant and relatively new field of computational mathematics for studying the shape of data. We compute topological and standard descriptors of model simulations generated by different parameter values. We show that TDA of model simulation data stratifies parameter space into regions with similar vessel morphology. The methodologies proposed here are widely applicable to other synthetic and experimental data including wound healing, development, and plant biology., Vascular networks play a key role in many physiological processes, by delivering nutrition to, and removing waste from, biological tissues. In cancer, tumors stimulate the growth of new blood vessels, via a process called angiogenesis. The resulting vascular structure comprises many inter-connected vessels which lead to emergent morphologies that influence the rate of tumor growth and treatment efficacy. In this work, we consider several approaches to summarize the morphology of synthetic vascular networks generated from a mathematical model of tumor-induced angiogenesis. We find that a topological approach can be used quantify vascular morphology of model simulations and group the simulations into biologically interpretable clusters. This methodology may be useful for the diagnosis of abnormal blood vessel networks and quantifying the efficacy of vascular-targeting treatments.","2021-06","2025-07-24 20:26:38","2025-07-24 20:26:38","2024-09-19","e1009094","","6","17","","","","","","","","","","","","","","","","","Citation Key: Nardini2021 PMID: 34181657 tex.pmcid: PMC8270459","","","","","","","","","","","","","","","","","","","","","","","","","","","","","","","","","","","","","","","","","","","","","","","","","","",""
